"3 hours long with 30 minutes of action, and all that action coming at the end so it's basically a 2 hr long drama with a pathetic final battle.This movie could of been 1 hr 30 max but they decide to drag on all the conversations that are all pointless anyway, Hawkeye gets more screen time then basically anyone and who cares anyway.They destroyed hulk and made him and Thor a complete joke, overpowered captain America and this movie should of just been called iron man 4Hulk dabbing and Thor playing fornite just came across as try hard and I can't believe how boring an avengers movie could be.Such hype for such a let down, anyone who reviews this movie as a 10 has absolutely no idea, how can this movie be a 10 it absolutely bores you for 2 hours then throws in some trash 30 mins at the end which is mostly Hawkeye and captain America fighting anyway which are 2 of the weakest characters and Thanos beats everyone so easily with no stones while hulk almost drowns from nothing lolThis movie was an absolute joke I hope Russo brothers don't make another marvel movie because this was an absolute boring peice of crap and they are destroying hulk and Thor"
	
"The first two hours seem like an attempt at drama plus almost no new scenes but rather a rehash of the previous 3 movies.The plot is essentially the same as the previous movie, Thanos wants stones, Avengers fight Thanos. The only new thing here is that instead of losing the Avengers win.I honestly felt like I was ripped off since I had to pay to see the same plot as previously plus a summary of previous movies...Incredible that no one seems to notice this, and completely mind-blowing that this movie will outsell Avatar which is an original amazing movie.The plot is so full of holes and makes absolutely zero sense as well."
	
"Let me start I'm a big fan of marvel so there is no biased against them.
This movie is a big pile of trash. Don't give them your hard earn cash like I did, wish I could take back 3 hours of my life.
Director thinks we watch superheroes movies looking for oscar winning performances.
2hours of nonsense time travel talk, about 15min action and than more nonsense pushing agenda #metoomovement?. I thought about walking out several times.Rubbish."
	
"Most annoying avenger movie, thor totally over shadowed, no charm n charizma of thor in a single scene....captain n iron man finished... captain would never choose his own self over the world ... you guys just had to finish his character so you took this irritating story line where catain stayed with peggy.. no goose bumps throughout the whole movie"
	
The strory was going nowhere and killing the thanos we loved and replacing him with one we didnt care about was a bad move
	
"First things first - I would call myself a moderate Marvel fan. I have watched most of the movies and know enough about the plot and general lore to be able to watch the movies without going who the hell is this every minute.Having said that I think that the movie was average. Not bad. Not good. Just a film you watch and then forget about two days later. When I watched Infinity War in cinema I was pretty impressed - I wasn't dying over it, but for a superhero movie it introduced a lot of new ideas to the table.Endgame on the other hand just feels like a chinese takeover from two days ago you stumble upon in your fridge. Most of the plot is just boring. There is little to no tension, the action jumps all over the place, the actions of the heroes often make no sense at all. I am not a fan of time travel because it takes a lot of skill and precision to write a story that isn't chaotic. And Endgame didn't manage to convey a good time travel story - which is like what the whole movie is about basically.All in all I think Endgame might have been released a bit to early. They should have put some more time, thought and effort into it, especially when this movie was supposed to be the grand, spectacular finale of such a huge scale saga. A bit dissapointing."
	
"I don't have to give away any spoilers to say this movie was terrible. I was so excited to see this movie. First, I have watched every superhero movie that lead to the creation of this movie. Please don't believe the critic reviews or other obviously paid for reviews. This movie was horribly boring, with very limited action. I enjoy comicbook and fantasy movies, but I also enjoy a good drama. The issue isn't that I couldn't appreciate the emotional aspect of the movie, it's simply that it was done very poorly. There were so many issues with the plot, and characters, but worst of all is a tremendous amount of pointless, long sections of uninteresting dialog. On top of this, the very few action scenes that were in the movie were really poorly done. For the most part, they were a blurry, choppy mess, and you couldn't appreciate what was happening enough to make it effective and cool. If you like movies that are boring, and try to play on your heart strings in a really contrived way, instead of being entertaining, then this is the perfect movie for you."
	
Firstly. I would like to clarify myself that I am a huge fan of marvel and never miss any movies right from the start. IW is a gem and rewatched over 10 times. All actors and actresses in these movies are simply the best in the world.BUT hey! This endgame is a joke! There is no way that I can fully focus on the movie due to the ridiculous plot holes. Time travel? Stones to return but no impact to the world that people from the past died? There's too many questions in my brain now. The more you think the worse it gets.Come on Marvel fans. You are ok to accept the epic era ends with a fat and lazy Thor and a nerd Hulk who can't fight? Not me.
	
"3 hours about nothing.
Only one reason why this movie has too large box office is hyping."
	
"I'm a huge marvel fan, and my biggest issue with this movie was how they treated Captain America. In the end he goes back in time to live his life with Peggy. Some saw this as romantic, the ending he deserved.I saw it as throwing away the years of growth we've seen this character go through to move on and be happy in the future. The film makers got scared and played the easy way out -- by sending him back in time. Not even touching down upon the time travel issues by having him live out his time along with a second Steve, did they really have Steve Rogers completely abandon his best friends for a girl he liked for two weeks?The ending of his character shocked and disappointed me. My review will probably be taken down, but hey. Maybe someone will see this."
	
Really? Time travel is how you save the world and bring back half of it?
	
"THE WORST !!!
they turned what should have been the best comic book plot, into a bollywood melodrama, it's just pathetic.
don't waste your time watching babies material."
	
"Don't trust the highest scores, trust the bad review. It's waste three hours film and bad storyline (not make any sense and confused). I don't understand why people likes it, I didn't cry or laugh but felt sleepy.Here are the few things that I don't like the movie
1. Too many superheroes against baby Thanos.
2. Timeline - That is cheating and all the superheroes stills lose.
3. It's not an action film, it more likes drama/sci-fi film.
4. Natasha (black widow) didn't have to die, she should uses Red skull.
5. Thor and Hulk are lazy and they are no need to be in the film and possibly the other superheroes.
6. What is Rocket doing? Why did he need to travel in time?
7. Ironman didn't have to put the glove on but use the remote control to snap the finger.I can't think of what else to write here but if you want to watch this, it's better to wait for rental dvd/digital to save your money."
	
Not sure about the rave reviews. But was a huge let down. It felt as if they just wanted to end the series . Infinity war could have been a better ending. Lot of flaws on time travel theory as well.
	
"I don't understand the hype behind this movie or most of the Marvel movies. I went into this movie open minded after hearing everyone tell me how great it was and after the first hour and a half I was bored. It's almost as if Marvel has started to make comedy movies rather than super hero action movies. Now I am fine with having some comic relief but holy hell. For starters, they completely ruined the Hulk and Thor who are two of the most powerful and captivating characters. I don't understand why they just decided to have the Hulk become a big joke of a character but they did. I thought his main thing was that he was angry all the time which made him way more interesting than a science nerd but ok I guess so. Then they decide to make Thor just a slob that drinks beer and plays fortnite. I saw Korg holding the controller and thought to myself if they are playing fortnite this movie is embarrassing and believe it or not they were. I could not believe it when I saw what they did to Thor. The God of Thunder and King of Asgard has a mid life crisis after losing to Thanos when he has 1000 years of being a battle tested warrior and is now an overweight bum and is that for the ENTIRE MOVIE.
The other thing in this movie that made me mad was that they tried to force all of these character relationships onto the viewer. I do not care about Hawkeye and Black Widows weird romance/friendship because as far as I can see, they are both kinda useless in the grand scheme of things. Honestly they both probably should have died in the first avengers but we will blame plot armor for that one. I also do not care about captain America and Peggy's relationship or Tony Starks new family that is a thing when the movie just jumps ahead in tome 5 years. This is probably because I think Pepper is one of the most annoying movie character of all time.
The last thing I will rant about is the fighting. For a 3 hour movie you would expect to see some cool fight scenes but no. We got a bunch of fast moving shots and a lot of different characters running with the gauntlet. To make matters worse, Thanos was just so not intimidating in the slightest. It's almost as if he stood 0 chance and everyone knew it. Overall this movie was 3 hours of superheroes sitting around telling some dumb jokes that people think are hilarious for some reason and then winning the battle with little trouble.
Other problem with the movie:
1. Bucky should have gotten Captains shield
2. Time travel? Really. Stark figures out time travel in 30 minutes after 5 years of sitting around and it works without any problem besides when captain America fought his past self and somehow nobody in the building saw it.
3. Thor joining the guardians is cool but also WTF
4. Captain Marvel should have just stayed with the avengers and try to fix the problem rather than run off to other planets and come back at very convenient times. Total cop out
5. The hulk should have fought thanos. Total blown opportunity"
	
Went into movie theater expecting an epic finale and a much better movie than infinity war; alas it was so anti climatic so boring so full of plot holes an elephant would've passed through them - or a hulk for that matter - very disappointing movie overall!!!
	
"I can only conclude that Disney are using bots to post 10 star ratings for this film.
Infinity War is better in every conceivable way.
I have to confess that after infinity war I had no idea how they could possibly top that.... it was going to take some great writing to turn the events of IW and create a movie that was better again.......I didn't happen.
I can't emphasize how bad I thought the story was.
It feels like a desperate attempt to conclude this saga early so they can start on the next wave.
1. You can't introduce a character as powerful as captain marvel into a fist fight.
2. Never ever ever use time travel in any movie... unless it's a comedy like bttf or hot tub.
3. Don't create scenes that make no sense just to appease the woman's movement in Hollywood...cheapInfinity war deserved so much more than this.Do yourself a favour and finish your saga with infinity war and forget this mess of a movie ever existed."
	
I feel like wasted my time and money on infinity as everything was reversed through time machine. So you never know if endgame will also be reversed in next film through time machine. Further first 2 hours are soooooo boring that you can skip and join for last one hour to watch action vfx.
	
"Has a lot of plotholes, but I still enjoyed it. However, the rating should be lowered to atleast 7 so im giving it 1 to balance it out, as all things should be."
	
I can't believe this movie has as high a rating as it does. This movie was so slow! It was more a drama then an action movie. You just had sad characters crying for the first two hours.And don't get me started on the time travel paradoxes. Time travel stories are for simpletons that can't write anything good.
	
"Seriously don't believe the 9.1 score and give the movie any more money.
Movie was a horrible mess.
Aweful attempt at oscar performance. 2hours of talking about nothing. Hardly any action.
Time travel nonsense."
	
"An all you can eat experience, but as most all you can eat restaurants the food quality is not the best. Shallow plot with many loopholes. Total waste of time."
	
"Seemed like 20 minutes of action at the most out of 3 hours. The film didnt need to be that long. The scenes that were meant to be emotional were executed poorly, didnt make me feel anything other than boredom. Seems all the 10 star ratings are just from marvel fans! Face it guys, it is a bad film. The previous avengers was 1000x better. The whole length of infinity war was about them defeating thanos, in this film it took them 20 minutes."
	
"This movie drug on far too long. Captain Marvel ruined every scene she was in. Stars given for Thors performance which was hilarious. Looking forward to Ragnorak 2, maybe."
	
"Highlights of why it's terrible.Infinity stones control the flow of the universe and cannot be removed (sorceress supreme - endgame), I destroyed the stones (Thanos - endgame).Killing yourself while someone tries to stop you is not the other person making a sacrifice (soul stone would not be acquired)A sword cannot cut vibranium, jesus thors hammer doesn't scratch the ain't (Thanos America)Scarlet witch can easily kill Thanos so why doesn't she finish the job.The power of the gauntlet is the user can harness the power of the stones without being affected by them. (iron man and hulk would be unharmed, Thanos was only injured because he was trying to destroy them, he explains this at the start)An android linked to a cloud would know that she is and would switch off her WiFi.Someone who would contaminate 50 years of history because he misses his girlfriend is a personality trait that would prevent them being able to wield thors hammer.There are hundreds of inconsistencies compared to the established universe, if you are giving this film a ten star rating take off your rose tinted glasses."
	
"They robbed us with the last move, for goodbye!
It is all about the money!"
	
This movie is so boring.Too many unnecessary details.You have to sit in movie for 3 hours so i dont think its worth it.I waa dissapointed and really sad after watching it.Dont waste your money and this movie doesnt deserve anithing accept 1.
	
"No Spoilers
This movie epitomises why I no longer pay to go to the cinema. It must be a free ticket and I must be bored. Those are my two criteria. It is therefore quite ironic that this film is boring. Was I not clear in my criteria. I said I must be bored. NOT I want to see a BORING film! I quite enjoyed Infinity Wars to some extent but this film was just plain stupid. It must have been written by the children of the directors. It's that bad. I tried to tolerate this film as much as possible, started falling asleep then pinched myself and thought, what tf am I doing here? and walked out!"
	
The drama was not in the form required and the comedy is not funny and some of the footage is meaningless
	
"Nowadays it is like a crime to say bad things against Marvel movies but someone has to tell the truth
This movie is extremely over-hyped. The first 2 hours there was almost no action, it was unnecessary endless dialogs, flashbacks and seconds chances.
When we thought we gonna see some action, it took 30 min only. And then back to aftermath dramas again.
I like dramas and deep stories in the movies but we already know these characters stories. why to over-extend that much?
Acting was empty and going nowhere, CGI was almost none since there was a limited action.
If it was up to me i would wait for torrents buy my gf wanted to see so much and in the end she also got disappointed."
	
"It's like they wrote the script after 3 AM the day before the deadline. This is the worst Marvel MCU film ever. Even Age of Ultron was seriously better than this,"
	
"As Soon as ant man enters the movie with his time travel idea , the movie goes downhill to a point of no return."
	
"I'm sorry but this movie was terrible. Boring and drawn out with some of the laziest writing and script you could imagine. So after the events of infinity war, you half half the population wiped out, Spider-Man, Doctor strange, black panther etc. All turned to dust, iron man stranded on a ship light years away from anything or anyone and we are all thinking where could the movie go from here?, and what is the best the directors could come up with?......iron man gets saved right at the start of the movie then the avengers that are left will just go back in time and get the stones and save the other ones. Ads you kidding me?? My 5 year old nephew could come up with better. Not to mention why not just do that in the last movie then?? They then spend the majority of the movie going back in time to previous movies so we can watch all the crap we've already seen. Just so after 2.5 hours we can get back to the exact same battle sequence with thanos and all the avengers as the last movie except in this scenario they get the stones off him. Pathetic. Why call this endgame?? It's already obvious they're gonna make a million more and never stop making this trash."
	
"My expectations are not above the infinity war, but movie was sucks in many ways, first storytelling was complex, if rat didn't enter microbus, movie wouldn't exist, directors ruined thor(fathor), also we didn't see hulk and black widow's fighting scene, strange played water, thanos became classic villain after infinity war, he was extremely nerfed too, there was only two emotional scenes, last fight was garbage, it's like directors told all performers '' let's join the fight scene concurrently '' fight scene was same with Aquaman movie, only war in Aquaman happened in water"
	
"Frank Capra had a golden rule - a movie can be many things but the number one sin is boring. Endgame - wanted to like it, spent money to like it, and .... boring. long, talkative and not worth the time. 2 hours would be fine, stretched to 3. Comedy was good mostly but not the padding. Long long intro shots of this and that. It finally hit the gold standard of DC. It took itself way way too seriously. So I am disappointed and sad. About right up there with Star Trek - The Motion Picture for boring. I don't like writing this, but ....... boring."
	
"Plot holes everywhere, cheesy lines,basically the average superhero movie and no one sees how bad it is because they're blinded by hype, endgame was a mediocre poorly thought out rushed movie that feels more like a cashgrab"
	
"The half part is boring, and its not really fun to see so many super hero, not a really good inspiring story or no story at all. Glad it finally ends."
	
"After GOT Battle of Winterfell, this movie just can't compete with its 20 minutes of battle. I found myself bored and wondering why it had soo many moments of cheap humor."
	
"This movie is a screw up for all the movies.This scenario of Time Machine changes the whole concept of the world or the Marvel Universe.If the good guys or super heroes can multiple times change the past, then why can't the bad guys or villains.Of course the heroes return back the item so that, they do not to change the time line.Let's talk about what could happen if Thanos or some mad evil scientist do something far more evil deed in the universe with the use of Time Machine.By chance kill Adam and Eve so that they kill all human existence.
Or
Something far greater Sevier he goes on to all planets or universe and kill the first born or species.And so destroys the whole universeNow let's get back to Marvel film.
Since we are talking about Time Machine. There will be all the time 2 people exactly the same, one from that period of time {(for marvel Endgame Movie) past} person and the (Future) person.Captain America (future) goes back in the past and marries Peggy Carter and stays in the past also gets back his unbroken shield to Sam Wilson.
Doesn't this tamper with the past. Having an extra human being also with the actual Captain America Shield. If means the (past) Captain America doesn't have the Shield.Also Nebula (future) kills the (past) Nebula. Doesn't this erase herself from existence. As without the past self, the future self cannot live on.There was also a scene where Iron Man and Ant Man steals the Space Stone.
So a secured and lock briefcase opens with a drop to the ground, without any force. Also Loki disappeared with the Space Stone in 2012 which will also cause problem with the time vortex. As something happened that weren't suppose to happen.Also the Avengers all get their stones without any hassle or fight. Something spicy should have been added.
What I mean is new villain or Jarves should have turned up the alarm for intruders. etc."
	
"Last avengers movie like we knew it. And the everlasting boring one, trying the mange some drama that Neve happened??? Bad jokes... Time travel??? Really? Captain America picks Thor's hammer?
What happened to this movie??? Storyline mediocre... Disappointed and waste of time. 3 hours wasted."
	
I mean come on. Is this actually the best movie you've seen? How is this messy movie better than Guardians 1 or Winter Soldier? This movie shouldn't definitely even be in the top 50 on IMBD.
	
"Infinity War is a Masterpiece and there is no comparison between IW and Endgame more like EndLame.
This movie is full of plotholes , poorly written dramatic scenes and not so funny funny scenes.
Why does Ironman has to die , why he had to wear the gauntlet to snap Thanos when they were going to beat Thanos anyway. Fat thor, useless Hulk, ant-man , captain marvel, hawkeye, captain America , black panther, doctor strange, spiderman , Ironman etc all were there. There was no need of that end snap. I know they wanted to give Iron man a farewell but in a satisfying way, in movie it felt like it was totally useless. And what about Hulk and thanos encounter , oh yeah there wasn't one. I was waiting for proffessor Hulk to step up to Thanos , another disappointment.
Many people liked the last interaction between Hawkeye and Black widow but personally found it cringy and over dramatic with lame writing.
In IW you can clearly see every character was given their share of screen time and justified roles but Endgame was mess .
I have watched IW in theatres 4 times plus many times at home and i would still watch it and enjoy but Endgame i can't.
Many stupid fanboys and casual watchers might find this movie good but the people who likes things making sense and a story which takes you deep into it would feel how unsatisfying this movie is .
Even casting Brie Larson as captian marvel wasn't that bad as this movie .Last words : Infinity War wasn't the movie we deserved but It was the movie we needed.
And this movie (Endgame) is not even close to what it should be."
	
"I thought i was gonna watch the biggest movie of all time but i watched 1 rating piece of crap of movie, coz i had to rewatch previous movies of mcu, repeated scenes of this stupid movie and also did i mention a back to the future version but outer space kinda movie.
One reason i watch movies is to get entertained and humor/jokes like rocket talking to stark and the other funny dialogues btw did they budget cutting or something coz we all know the movie was gonna make more money than disney even have instead they preferred people going to the future and change stuff from before. And one more thing why kill the two biggest mcu money makers?"
	
They open the story and characters very widely so closing the chapter was a mess. Too much drama (poor one) main characters was missing. They gave role of Thor to captain america and hulk as carton green man. Worst avengers and really it's an end game (just a game).
	
"Are you kidding me? I have been waiting years for this movie and they make it for young children. If you're so sensitive for your child wait until it comes out so you can watch it with it rather than complain at the movies. I'm also not impressed with Tony and Natasha's death why does Captain America get to just live his story has been told. I think Tony deserves retirement with his family. Natasha's death could've been a little better. Captain America could've taken it or one of the stronger avengers for the huge sacrifice, but no Tony has to do everything. Couldn't they just use the quantum realm to help them get him back so he could retire?? Come on marvel I know this couldn't be rushed but couldnt the characters get what they deserve?"
	
"Indulgent rubbish. Do yourself a favor and just watch infinity war because this film is boring and by the end, I just did not care anymore!"
	
