"Watched this effort and was disappointed. In fact, the last three efforts from the writers and directors of Winter Soldier have been sorely lacking. Where is the superb action in these films? The entire fights on the ship, highway, and elevator in Winter Soldier were not only intense, but they were exciting to watch since it showed the great skills of both Cap A and Black Widow. It also showed them winning. In Infinity and Endgame many fights were depressing, except the short fight in Endgame. Winter soldier also had a great story, where many difficult situations were sorted or calculated by Cap A and Black Widow being skillful fighters and brilliant strategists. In Endgame, the creative and brilliant science prodigy Iron man looked inadequate. The writers could have had him, together with Nebula, thinking creatively to get back to Earth using the Milano instead of cheating the storyline by having Cap. Marvel suddenly appearing. What about Antman? The film had a rat conveniently pressing the right controls to have Scott Lang fart out of the van. Wow, what a plot convenience!. Surely, Scott could think of something in five hours to get out of the time vortex. Another superhero made to look inadequate. Let's get to Hulk and the tragic storyline of the God hero Thor. The former had no chance to avenge his defeat directly at the hands of Thanos. Surely, the immense strength of Hulk together with the brains of Banner could figure something out. And Hulk's reaction to Black widow's death was pitiful. He did not even get angry and tip over the edge. Come on, what is that? Boy, after the heroic turn of Thor in Infinity War, here he is reduced to a fat God that cannot even defeat a Gauntlet-less Thanos with the Stormbreaker and Mjolnir. I feel bad for the brilliant Hemsworth, who had a great turn in Dark World (went to his post-Avengers Loki for help with defeating the Elf. This was brilliant storytelling) and Ragnarok. The writers had him lose twice to Thanos. Where is the satisfaction in that! Where was the satisfaction of both Scarlett Witch or Nebula not having Thanos suffer greatly for him killing Vision or abusing the latter for many years, respectively. The storyline should have been better constructed. Cap A could have had a better fight with Thanos. He is a master strategist and fighting soldier. Couldn't the writers have had him training for Thanos in the last 5-6 yrs. Improving his strength and getting to know everything about Thanos. Couldn't they have had him helping the weak through fighting the bad guys in the meantime, like Hawkeye. Hawkeye's story was good, as the film resembled Signs to s small extent in concentrating on a small family situation and why it was necessary for him to reverse the snap. The last three films have been rushed. In Civil War, everything was supposed to be ok after Cap writes a letter to Iron man. Come on. Take time to write a great story that these films deserve. To have all the heroes return in the last 15 mins is pathetic. These heroes deserved more time. Gosh, Okoye's fighting skills were not even displayed as well as they were in Black Panther. The hype far exceeds the fun factor in this movie and the past two. Not been satisfied with Marvel since WS. Have not bothered to watch Antman 2 or Captain Marvel. This was bad."
	
"MCU first killed Jarvis, then killed Tony. I hate MCU. MCU and Disney are spoiling Marvel characters."
	
"I don't know if I would like to go to another marvel film after that - the writing was really bad!
Why did Captain Marvel didn't do that instead of Iron Man? She is pure energy...
Why did Dr. Strange didn't opened a huge portal for Thanos and took them elsewhere?
Or more simply why no one let Strange the time-stone and he just make a milion years go by on Thanos army.
What happened to Thanos' ideology of saving the universe? Suddenly he just wants to destroy it?"
	
"Time travel destroys any film...time travel doesnt exist in the physical world..its an invention of writers and authors to close plot holes and impress audiances...so, any film or book containing time travel, IS A MESS! so, i dont see any reason to grade this movie more than 2 stars...cgi, fights, ok , but a real good movie, must have a believable story! for me, sorry it didnt work...
question...why thor and hulk had to be humiliated so much in this movie ? why toni stark had to die? to offer the framatic essence to the story?is this the end of marvel heroes?"
	
"Welcome to MCU in 2019 where feminism, cultural Marxism and humorless comedy rules.The movie started beautifully with Clint losing his family... too bad that was as good as we were gonna get.Russo shows up as a dude telling about his date... with another dude... cuz Of course... that makes sense... half the world died but that lifestyle can't ever get enough....Captain Marvel is still annoying and unwatchable - oooh! She squints! Just about the worst actress to ever play an MCU character.., thankfully she's barely in... reduced to a horrible Deux Ex Machina plot device - which makes no sense - basically her MO is: Earth was attacked by Thanos twice, and both times she was chasing babes on the other side of the universe...If time travel wasn't bad enough they also go 5 Years Later on us... and basically break every known rule about either narrative device - so Peter disappears for 5 years but goes back to the same high school class? His friend is there waiting for him still looking as young as when he left??? Did they both disappear???Cap is given a silly ending - the guy who would never let any evil ever happen without fighting til I can do this all day basically lived for 70s in obscurity playing hooky with Peggy Carter
Also - he notices and appreciates his own behind cuz of course!Hulk looked stupid, acted stupid and woulda been the biggest betrayal of a character arc if it wasn't for them reducing Thor to a fat crying drunk... who's still good to battle but just a sap Whenever the plot demands...The scene with all the female heroes was vomit inducing - yeah that makes sense the world is turning to crap and Hope is actually inside the van helping ant-man but why not go all #Resist meets #Metoo cuz #ImWithHers 2020 - I was surprised Kamala Harris didn't play a half East Indian Half Wakandan warrior with the power to go down on her knees anytime she needed a Job in politics...Since there was not enough plot mechanics in time travel and 5 years later they also added consciousness sharing doppelgangers and Gamorra from the past now being stuck in the present so...At least Downey Jr, Evans and ScarJo are free to never have to step foot in this terrible manipulation of fandom which had its peak with the great infinity war but ended with the worst marvel movie this side of captain marvel..."
	
"The plot was messy, and so vast, with so many amazing characters, who were all simply diluted into one giant mess of a movie. Didn't really find the humour amazing either."
	
"Well. Went to see it opening night and came out so disappointed. Was reading reviews when going in (without the spoilers) that were so great only to be hugely disappointed!!! No spoilers in this review as none are really necessary. To much time on empty characters (Hawkeye), way to long to bring back the half that are gone so most of the movie was wasted with slow plots that will be destroyed in the end. The captain ending is stupid. How many holes are there now!!! And boring hulk!!!! Why???? Infinity war was on a different level and this just fell off from the beginning. I felt like when I watched the NEW Star Wars movies. Total waste and let down. I think they forgot what got them this far and just caved to making the almighty dollar in the end."
	
"Waited for the endgame ever since I left the theatre after infinity war. I really wanted to enjoy the movie, I even cheered for all the cliche stuff that was shoved in the film as what you would call fan service. But what the writers did to the fans was really disrespectfull. They wrote off all the heroes whose contract is done with marvel in the most rediculous way possible. Oh make hulk all green , sacrifice black widow for no reason, make captain America old, uselessly old, and please don't get me started on the unnecessary killing of Iron man the God father of the what so called Marvel Cinematic universe. They wanted us to give up Our old heroes to make way for their new ones, but just because we are fan they can manipulate us the way they want, but just because we are fans this is the one thing we won't do. It's not easy for a fan to let go of his hero and move on. We deserve a better end than that, their heroes deserve a better end than that insult. For heaven sake even Loki deserve a better ending than that. As a fan I was ready to allow all the none sense the story had, but insult me and take away my favorite hero and I will eat you alive. I will allow the whole concept of time travel thing, but let's go through the logic they had to fix everything. They would go back in time and steal the stones from different timelines bring them to the future snap their fingers bring everyone back, okay after that it gets stupid they will return the stones back right when they took them, wait won't that be putting the stones for Thanos to take again in his own timeline to snap his fingers and repeat the loss AGAIN. Why wouldn't they just go to the past destroy one of the stones once and for all. That would have at least saved black widow. Why would iron man snap his fingers why didn't he use the power of the stones and kicked Thanos ass at least that would have given us the satisfaction of revenge. How did Thanos get all the pym particles to get almost all his planet on earth through time travel in quantum realm when the avengers themselves had only enough for ONE ROUND TRIP. Where did the Asgardians come from. Didn't Thanos destroy their whole ship in the start of infinity war. How did the valkirey get her white horse for heaven sake have some respect for our heads and what good did the flying horse do really Nothing. Why make Thor this miserable and useless, that's not fair to his fans at least, why give him 5 minutes chat with his mother when it does nothing to his morals or affect the story at all. Same for the starks father son meeting absolutely meaningless. Where was Thor and iron man when Thanos beat the hell out of captain America, sleeping ?!! The end fight scene was terrible in the least. Single fight no unity at all even though they were all there and what became of Thanos they did better fighting him when he had the stones now that he is without them he becomes invincible why?!! Just to kill away Iron man?!! And don't get me started on the boring out of context gay conversation captain America has with an unknown and why he gives his shield to falcon just because he is black, leaving Baky his almost brother behind. The girl power scene was crab and too imposed. Spider man comes back after 5 years to find his friends still at high school ?!!! You ruined it all Marvel ,you destroyed my 11 years of entertainment with a really horrible ending that just serves you and not the dedicated fans whom made this possible for you. That is a promise from me and I believe from many other fans WE WON'T BE SUCKED UP IN YOUR WORLD OR UNIVERSE OR WHATEVER AGAIN. THAT IS IT. FIND NEW FANS."
	
"Last 30 minutes was overly sentimental, however, there were some scenes that made me have goose bumps. It was not what I expected."
	
"The avengers: End game movie is the worst out of all the marvel movies. With an horrible end and a bad plot. For a normal, sane person this is a too wacky movie with a lot of weird twists. The only really good thing in this movie is the avengers theme song that gives the movie a little spark in the total darkness that it is in. If you consider watching this movie DON'T."
	
"When Infiniti War ended by Thanos winning, I hated it. Though I new that this year's Avengers Endgame is going to be going back to the past etc. But never thought they will end it by Iron Man's death and the Captain's retirement. Who's going to save the world when another Thanos is born in the Universe?
Thank You."
	
"Time paradoxes are glossed over, bad story writing, completely wasted my time"
	
"First off, phenomenal cast. I can't think of another movie that had even half the headlining talent that this one did. Still, it just plain sucked. Terrible dialogue, boring and repetitive special effects, and longer than Gone with the Wind.Also, I detest Gweneth Paltrow. I'd have given a 2nd star if they'd killed her, but they didn't so I didn't."
	
Wow! What a POS movie...So much talking. So much crying.. So much boring no action garbage. These high scores must be paid off. Don't believe the reviews. Stopped watching in one hour..and yes that first hour was painful. I can't imagine fighting thru another two hours. What a shocker. A three hour movie that stinks. Who's idea is it to make movies three hours?!?! Most of them are garbage.Skip this at all costs
	
"Thanos original purpose was to give his bride The Dead itself, the half of universe´s lives, as wedding gift. The evolving thing was too sense as a goal for a mad cosmic being as Thanos, anyway none care about it. The old comics are covered with dust and oblivion.I couldn´t stand the Captain America having the power of lightning and masterfully using Mjolnir, like he was expend training all his life with it. Totally sickining. He is worthy well he just need it to throw it, and wield it, just like that.Hawkeye the forgoten advenger was in a crazy rol, who cares? Where were Adam Warlock and Magus and even more The Living Tribunal?Why name this movies Infinity war? with the excuse of the alternate filmic universe, very powerful plots are crumbling, one after another.Maybe that happens when you expect that new things overcome the old ones, or even that match just a little."
	
Watching this movie has me seriously thinking of inventing my own time machine. I would either go back and prevent the Russo brothers from making this movie or at the very least go back in time and not buy tickets to this movie. All my hopes that had been built up for a year were shattered. Dropped. Smashed. Shattered.
	
"Disney's grand attempt cash grab, trying to kill off characters while pandering to fan theories on who should live. Movie doesn't deserve a high rating because it is not theatrically complex. Time travel is a terrible cop-out for a real plot device."
	
"Fist I would like to say I don't generally love superhero movies. And I'm not really I big MCU fan and stuff like that.All that being said this was not a good movie.
It felt very predictable and formulaic the it was just like every other superhero film I've watched except a few with a few different villains. I thought they made the Hulk character really stupid. The he's not interesting if he doesn't get mad that's what makes the character interesting. Also the whole time travel thing didn't make any sense and just felt like other scenes and different movies.Then there were so many plot holes. Like isn't the timeline now all messed up? If you like action It's average. If you like story it's pretty bad. If you want something original you've come to the wrong place."
	
"For me, very boring and the characters persona as they were before just ruined in this movie.
I have greatly enjoyed every Marvel movie except this one."
	
"Avengers: End Game is long, boring, and predictable--with an endless amount of fan service. The humor in this movie just doesn't get a laugh. I cannot express how disappointed I am with the conclusion of 10 years of movies. I'm shocked this film is actually getting good reviews. This will be the last Marvel movie I see on opening night. I cannot help but think this is the beginning of the end for the MCU. It was good while it lasted."
	
"Cheesy and dumb. They could have done so much with this movie, but completely failed. There was WAY to much comedy and PC moments. Definitely a waste of time and money."
	
"I honestly don't understand what people liked in this movie. There was too much inspiration from a third class chick flick, with completely useless emotional scenes from super heros who don't really inspire any emotions. Acting and dialogs were also terribly executed. The movie could have easily be completed in half an hour without losing any content."
	
Not fair to Thor. 5/10 Cheesy jokes and So conclusion. Just A Business Movie on Super Hyped Fan base.
	
"No Thanoscopter
No Thank You
Get your stuff together Marvel"
	
"I must have watched Infinity War a dozen times, so as you can expect I was expecting big things from this movie. How wrong was I. Shockingly disappointing. The people on here giving 9 and 10's must be scoring infinity war by mistake. The film was so boring and the story was rubbish. CGI took a massive step back for me. I will not be watching this dribble again. Well unless it's on cable tv at Xmas day in 4 years time and I'm too full of dinner to get up and change the channel."
	
"No single fight scene at the start! Talk too much entire film! More like romance than an action blockbuster! Disappointed for action movie fans! Wait 2 hours more to watch the Avengers assemble and fight with Thanos! Most intense fight scene is Thor team up with Captain America to fight with Thanos! Many people asking why Captain America can use Thor hammer and ax! Actually who care! Silly time travel heist concept! And Marvel Studio's movie nowadays won't stick to previous film storyline anymore, they like to write whatever script they like! Good movie should not bored audience! This movie certainly not that kind of movie! I actually crying when Hawkeye race with Black Widow to jump off the cliff suicide! So silly but touching! Action scene really cannot outclass Age Of Ultron! Lastly really hope Anthony Mackie won't takeover Captain America character! Lol!"
	
This movie kinda sucked. Even worse than most other Marvel movies. It was just a mess. They shouldn't have even tried to explain their time traveling/dimension jumping. Quantum physics? Really? Ok. This movie overall is a comedy. There are a few pretty funny jokes. But most movies are much better than this movie.
	
"First thing is Thor is a stronger character that can make huge changes without stark's Death
Second thing is captain America can have Thor's power because oden whispered to his hamer that one will have it only
So the mistakes I saw there was Thor was useless and captain America got his power
Third thing is captain marvel didn't make any changes so the purpose of this character is making money !!!!"
	
"BORING!!! TOO LONG!!! Two of the main characters, changed for wearing diapers. DISAPPOINTING."
	
More than half of the movie is boring with a very bad script
	
"My kids were very excited to see this but I was more apprehensive. Really, the film is far too long, just unnecessarily. Parts of this film were very boring and were an ideal time for a cinema snooze! It had so much more potential but directors lost site of their aim. Disappointed."
	
"It is the worst scenario ever . How could you defeat the most powerfull character in the marvel universe as he is child ? And All of the logic errors ?? Making Infinity War :
MARVEL PARADOX:
1-In the First movie kill many important characters
2-Oh no ! we can't get money without them we have to save them !
3-Save them with silly time machine or incredible things
4-Show off them for 10 minutes .
4-Repeat"
	
"Poor cgi for big budget movie! Nothing special in acting, regular things... Copy story from other movies like Inception and Star Trek.. Poor cinematography and soundtrack! General nothing special, nothing unique!"
	
Kids wrote plot for the movie. Ppl are getting made for nothing
	
It was really bad. Incredibly slow. The plot was full of holes and they pretty much destroyed some of the best characters ever.Just a really bad movie.
	
Problem with time travel is if your not careful you make the whole plot impossible to believe. End game doesn't even come close to tieing up its loose ends. The remaining avengers act selfishly and arragently to the point you want them to fail.Thanos did nothing wrong. I hated this film.
	
"I was really hoping to watch a good movie. I have seen all Marvel movies and was excited with the 10 star reviews. But this movie is basically garbage. A lot of characters doing random things. There was no interesting story line. The emotional scenes did not have any impact. The action scenes will leave you with a headache. What amazes me is people giving a 10 star, please be honest to yourself and rate correctly."
	
"My rating is purely based on the ending. The movie was probably a 5 at best imo. There were cool parts of course, like Cap wielding the hammer, fat Thor, Ironman and some other stuff too.But the overall movie did not live up as far as I'm concerned. It never followed through with the epicness of the last one and it never lose enough from an emotional standpoint.Captain America deserved an honourable death, not becoming an old fart.Thor deserved to find himself after the depression, especially after meeting his mom and then die an honourable death too.Hulk deserved redemption after the awesome scared angle from Infinity war.Ironman got an awesome ending of course.Personally, I feel that Endgame should have provided more of an end - true finality - instead of continuously trying to build for the next Marvel run."
	
Not sure why they included all that time travel and extended fight scenes for. I think the advertisement was pretty effective when Tony Stark rolled up in his Audi. Just seems a bit overkill for a car commercial you know.
	
"The movie unsuccessful attempted to get sensual but it was way from it ,it felt like a roller coaster with the sequence of action, too many things happening in a short segment that will throw you off from enjoying the movie , it is too long and that tells you something , too many characters , lol you will get lost, like wow this a way odd. If you decide to watch it avoid the 3D version. Honestly , it was way below my expectations ."
	
"The 10/10 reviews baffle me. HOW on earth? People using words like Perfect Amazing Brilliant need their heads wobbled. It's the worst marvel film made, with more plot holes than Swiss cheese, insulting the intelligence of real fans.
I'd like to hear what Ruffalo, Hemsworth and Downey Jr feel about having marvel screw their characters over like they did."
	
"****SPOILER WARNINGS FOR AVENGERS: ENDGAME****Disney's apparent quest to make male characters less traditionally masculine and female characters more so, results in a convoluted tale whose biggest sacrifice is a coherent story.Start with the disasters that are Thor and Hulk, the two characters above all known for their great strength. Both of them are castrated of their power in this film.Thor's last two films have been a comedic spoof of his character. Late night television couldn't even spoof him anymore, for they have done it themselves. The god of thunder is now a useless, emotional wreck drunkard, not just for one gag, but for the entirety of the film. Hulk, made famous for his struggle with violence and bouts of destruction likewise is reduced to comedic fodder, including a joke about his inability to Hulk-out with rage anymore.To a lesser degree Captain America is another emotional wreck and runs a counseling group. In it, we are sure to have Disney praise gay dating to check all the PC checkmarks. At the end, he passes his shield to Falcon and the five-pointed star is clearly inverted in the shot, which doesn't help Disney's reputation for adding devilish or cultish symbolism in films.The main women in the story, with the exception of Nebula, are depthless, Mary Sues - the new business model of Disney and other uncreative Hollywoodians. Danvers, Natasha, the witch, Okoye, Gamora, Wasp, Valkyrie, all overflow with competence. There is little to say about them other than they are all clones of the same character, filled with all the strength and competence lost by Thor and Hulk.The film drags on for seeming hours while we are shown what an apocalyptic wreck the world has been for five years since The Snap. Why is it apocalyptic? Who knows. There are still 3.5 billion people on earth. Has everyone just been in counseling while baseball stadiums collapse and are overrun with foliage?The movie, devoid of originality in every scene, is filled with cliches about how it's gotta work and other painful dialogue. The climactic moment, where Stark *literally pickpockets* the stones from Thanos in about two seconds, is a cliche overdone ad nauseum. The protagonist scuffles with villain and is defeated in the fight-but surprise! The protagonist produces the thing he snuck from the villain. And the villain has his mouth hanging open. And so do the viewers who can't believe they paid to see *another* movie with that climax.In short, Disney has about killed the Marvel franchise."
	
