"I will write this review as a way to unload how frustrated I feel after watching this movie.First and foremost, Tony Stark's plan to bring everyone back after a 5 year gap is absurd and selfish. After 5 years you should be able to balance the choice of leaving everything as it is OR going back and changing everything back to how it was. Keep in mind 5 years is a very long time to have been pronounced dead. The paperwork to bring these people back into the system and the burden they will now be on the economy and Social Security, at least for a while, would be enough to bankrupt a nation. Conveniently, all MCU's family and friends were either fine or they had all vanished together so having them come back unharmed, albeit 5 years later, is a relief. That is not likely the case for the rest of the world though. Most of the people coming back are coming back to a drastically changed world. Most will be homeless, they have no jobs, no way of getting a job, not soon enough, anyway. Some will have lost family members and beloved pets during that time, to old age, suicide, accidents and all sorts of natural causes. And some, if not most, will be coming back to a world that moved on without them. Their loved ones may have already found others or have been changed so drastically that they're strangers now. If you watched Tom Hank's Cast Away and recall his hopelessness after coming back to life to find his house sold, his insurance cashed, his job taken, his industry changed, his wife remarried... Now multiply that by half of the Universe's life forms and you have an unmitigated tragedy of cosmic proportions. All so that Tony gets to keep his 4-year-old?
No. Tony Stark's toughest choice should have been that. Am I willing to sacrifice my daughter to save half the life in the Universe? After that, snapping your fingers knowing you will die should be a piece of cake.And then the time travel ordeal... If the operating theory is that you cannot change the past then you should be unable to change the past, PERIOD. The only things that can happen are the things that have already happened. In that scenario, it is plausible to assume you'll be able to go back in time, steal the Infinity Stones unnoticed and then but them back... But all of this is only possible IF they have already happened. Complicated yet theoretically possible. You can even justify Thor's conversation with his mom or the Ancient One's chat with Banner because we were unaware that these things had already happened then, even if it is our first time seeing it. But then you have the Cap fighting with himself and telling other's he's with Hydra, Loki's escape and the cap moving back to the past to grow old together with his long lost love. You could argue that the Cap made himself forget the fight with the scepter and lived secretly in a basement for the rest of his life, but REALLY? And what about all the undercover Hydra operatives that will soon find that the Cap is not really on their side and hence must know of their own involvement and what about Loki? How was he still a prisoner for the end scene in Avengers when Thor escorts him back to Assgard and where he is later seen in prison? And how are we reconstructing the Tesarract and putting the Ether back into Natalie Portman? Or CAN you change the past after all? So why not do the unthinkable and kill one baby (Thanos) to save half the Universe? Send Hawkeye and Black Widow to do it. Why not travel in time to beat Thanos at Wakanda, now with the help of the entire team, including all of the dispersed heroes and Captain Marvel? Or did we just create 6 different alternate realities and timelines but somehow feel good about our victory in just this one? And is the Cap comfortable going back to 1945, hanging his shield and watching history unfold without altering a single thing, knowing full well all the lives he could've saved (think Vietnam, Kennedy, 9/11, etc.)?And how does every single main character survive the final battle? They blew the Avengers headquarters to smithereens yet they're all somehow unscathed sub-level 20, just brushing off the dust. Or when Thanos made it rain fire? I get some are meta-humans but others have latex suits and some body armor, nothing more. How are there not more casualties?I could've lived with Thor's beer-belly, the new Hulk and the rest of the idiotic jokes if the movie itself weren't a joke already. The logic seems off and I am just thinking about this now. These people had 10 years to write a better story. The movie was made painfully long because of gaping plot holes rather than by great writing."
	
"I am a huge sci-fi fan. I really like marvel movies but not a MCU person. If you liked all MCU movies and are a marvel fan don't read anymore just go see it, I'm sure you'll love it. I have to admit Infinity wars was a very good movie and easily re-watchable. I was very upset at the ending and the twisting of spiderman dying. Now spoilers (duh).
What I didn't like
(1) 2 hours and 40 minutes of dialog and 20 minutes of cheesy CGI.
(2) Thanos please shut up. Please, you talk way tfm.
(3) Woke much. Blacktain America. Power Puff Girls, CA therapy new age session
(4) Captain Marval is way too powerful, why do we even need the avengers?
(5) So predictable but you knew I was going to say that.
(6) Time Travel sucks but what are you going to do over and over again.
(7) Thor belly gut funny for 1 minutes, then super sad.
(8) I was dragged to this movie by my kids
(9) RDJ got like 100M for this stupid thing. Girls, Shmirls...hiding under a bar
(10) Comedy was terrible. Only 2 jokes I liked.
(11) Drama Queen Thanos gets two deaths?
(12) I feel bad for Peter Quill. Gomarah was resurrected but doesn't know him.What I liked
(1) Go eat a salad...great line.
(2) Tony Stark meeting his father. Very heartwarming. Only nice moment."
	
"Had high expectations for this movie, but is was the worst =("
	
"What's up with the time travel?
The OA also dig into this kind of multiverse travel, but clearly they did it better and try their best not to put tons of plot holes into their film, but clearly the director of Endgame decided to ignore it. Seems like their fan base forgot their brain when they watch this too based on the ridiculously high rating of this movie."
	
"Really disappointed after watching it yesterday. Unnecessarily long, very boring finish to a series of movies with a lot of peaks (Ragnarock, GotG, CaptA) and quite a few troughs (AoU, Iron Man generally, Black Panther) but I thought this was a new low. Really poor writing, idiotic plot holes and stupid action scenes. Really sad end.. felt like flogging a dead horse, shame to go out like this."
	
"What can I say the title says it all, the director is really screwed up with the hulk he didn't even have a decent fight scene. The story it was kind of boring also fell asleep practically in the middle of the movie. This movie felt like a Hollywood director made it instead of a real fan the way it should have been made. And the CGI was horrible"
	
"Expected a lot more honestly. Infinity War was way better. After they make out the plan, everything is predictable."
	
"What happens when every one of the millionth characters pretend to be important? They're all plain flat.Felt for 3 hours that my job was taking care of the cctv of the busiest Black Friday store, where a huge crowd fight for nothing and eventually someone gets something of value.Dr Strange creates the cheese holes out of the blue to fight Thanos... pathetic reaction of the audience seeing Black Panther come into action.... predictable and pointless. Effectist, I'm sure. A movie for hopeless generations needing to be represented by a super-tag.Once the dream was to have super powers, fly, move things, you name it.Not it is to feel represented by the person who does it. Enter Black Panther and Captain Marvel.Marcel studios monetising on social movements. How lame is your life to need that representation in an action movie? It's a story of them, not a story of you!I saw a long cctv recording."
	
"This movie was pure trash, it was slow and lacking, it didn't have the climax that the Infinity war had. The male characters took all the spotlight throughout the entire movie. Captain Marvel barely had any limelight in the movie. Poor Natasha Romanov, the way she died, to me was very unfair, and Hawkeye became a rogue criminal, killing innocent people just because his family was gone.Really, like he was the only one loosing a family! In the other hand, Thanos was nothing but a dull villain with no solid purpose whatsoever.The plot was too rushed. One other thing was I didn't like how the Russo's brothers portrayed The Hulk in Endgame. I thought he was going to have a rematch with Thanos after loosing to him in Infinity war. A fat Thor! are you kidding me Marvel, one of the most powerful avengers and you made this guy look like the god of mommy issues! I tell you there were too many flaws in this movie. At the end I have to admit Deadpool was right, I don't want to see another Avengers movie."
	
"*Packed with MANY spoilers*Let's get real. This movie was so massive, but it has sooo many plotholes! Make no mistake I love Marvel, but this movie was not the best that's out there from the MCU. I loved how the movie pays homage to the previous films, I thought that was quite clever. But I personally expected way more action earlier in the movie.Thanos snapped half the universe in IW. But we didn't really get to SEE the direct impact on Earth in this movie. No chaos. No news. Just a ... quiet depressed world? Really? I wanted to feel anxious and feel like all hope is lost but it never really got there. Even during collecting the stones from the previous timelines.The attack on Thanos in the opening scene was lame. This guy was meant to be a massive villain that the MCU has been building up for a decade, and his death was over in minutes. Captain Marvel's lack of screen time didn't make any sense, she's so powerful yet was hardly there. I get that the writers were focusing on the original 6 Avengers but there were scenes where it would have been interesting to see her in. Yes, this is the Avengers fight, but it's also Captain Marvels universe that has been affected, so not seeing her as involved as Ant-Man or Nebula was disappointing. Oh and obtaining the Soul stone... Nebula couldn't warn Black Widow and Hawkeye about what was coming? Seriously?? Not something you want to mention beforehand?How did Thanos's ship time travel without a) starks tech and b) the Pym Particle. HELLO THE SHIP WENT SUB ATOMIC INTO THE QUANTAM REALM AND TIME TRAVELLED. What did the 2014 Nebula do to make this happen? And no one noticed a massive ship come shooting out of the time machine and out of the Avengers base?!When Hulk reverses the snap... again we don't know the impact it had on Earth / the Universe. What actually happened? Was everything reset back to 2019, or were the people that turned to dust returned into a new time (5 years later?) and if so why was Peter back in highschool?? And what about the people that were already on Earth, were they also set back to a time right before everyone dissappeared? I guess we see Cassie (Ant-Man) all grown up at the end, but come on... this was a MASSIVE ISSUE and it was not explained in any way whatsoever. I get they wanted the dramatic entrance of the dusted superheroes, but even after the mega action scene at the end there was no explanation of how half the universe came back into life.The movie also never really showed us as an audience the 1 in 14 million ... chain of events that led to the win. Could anyone else have snapped their fingers and dusted away Thanos and his clan? Again... no proper explanation.Tony stark starting the MCU infinity saga and also ended it, perfect... and giving him the appropriate screen time at the end. What about black widow? Couldn't Hawkeye bring her body back? Couldn't someone else travel to where she was and get her body? They just left her there to die alone?For a 3 hour movie you'd expect more of closing story or better explanations, but instead time was wasted on a slow start to the movie. Nonetheless I still enjoyed this movie and it will come to grow on me more and more, but I'm always going to have these questions in the back of my mind every time I watch.Oh... and don't get me started on the time travel MESS."
	
I'm sorry but this movie was boring except for the last part. Infinity war was well balanced and every character had a role. Also had action from beginning to end. But endgame mostly had unnecessary talks or travelling here and there. Most main characters don't even have any fight scenes. Whole movie is focused on only 2-3 characters. Rest of the characters were in it like they just have a cameo. Should have made a semi team up film after infinity war and then Endgame with all the characters having enough screentime. Wasted opportunity.
	
"It's a long film at 3 hours the last one being better because this concludes the 10 year story in at great and satisfying way. The first 2 hours are build up that is ultimately paid off but I felt the middle dragged on I just wanted to get to the end. Infinity war kept me interested the whole time, more than endgame. It's definitely worth the whatch and after you don't have to worry about spoilers.8/10."
	
Anyone of Thor's fans wouldn't accept Marvel's adaptation of Thor. They ruined Thor this character just for making him as the funny elements of the film
	
"Spoiler spoiler spoiler!!!!
I never reviewed a movie in my life but as i just read what the Russo's said about the Hulk and his permanent damaged arm i see that they dont know anything about the character. First no one tackled that he gets stronger when he is angerier second that he has a very high healing factor!
They destroyed him in IW and continued with Endgame. I had high hopes for Endgame based on the ending of IW but i was very disappointed starting from the above and Cap going back to the past and iron man being the center of the universe!"
	
"I'd give this movie a 6/10 at best - it's a mindless action movie trying to be more and people seeing it as more.There's amazing CGI, and when you throw in countless superheros any cliche makes your hair stand up. But for me, this entire film revolved around one-liner comedy in place of character development, and what it's known for best... mindless action.The action doesn't even have to make sense, like Thanos magically 1v5'ing with no infinity stones when in the previous film had issues 1v1'ing with stones. The entire movie is hype revolving around a ridiculous time heist. They even made jokes about how stupid the idea is, and in 30 seconds Iron Man figures it out.This entire movies is cliches, re-used tropes, and one-liners used by familiar actors and amazing CGI. If that's all it takes to be great, good for you!"
	
"The Russo Brothers will be forever known as the directors that failed a franchise and insulted the very fans that embraced it.I have no idea why they felt their finished product would pay homage to Stan Lee's legacy or the characters he brought to life but this closure to a decade of greatness was, in fact, the most disappointing 3-hours of character assassination in cinematic history."
	
I can't describe my disappointment. The movie was very boring with predictable happy end.
	
"Josh Brolin's voice was totally wrong for Thanos. The lips didn't even match the words. I'm also just tired of seeing the SAME old mad man trying to destroy the world and getting defeated by super heroes. Too many characters.At least with the Dark Knight and some of the X-Men films they mixed it up and felt fresh. More superheroes doesn't mean better. Plus the acting was atrocious. The wooden repartee didn't help, done only to make sure everyone gets their lines in.Try a new storyline and/or approach. SKIP IT!"
	
"This movie was a waste of time. I went to see this movie expecting something epic... more epic than Infinity War but was grossly disappointed. Movie was too slow, no action, much drama. I thought this was a comic movie? I wish I could give this movie 0/10."
	
"It's the finale! But they choose to not focus on CGI, EDITING, SOUNDTRACK, CINEMATOGRAPHY, even in storyline! (Time travel, paradox, time here is 5 hours, there is 5 seconds) Same old story! Nothing new, nothing special! They made this movie only to remind us the old MCU movies, it's funny, it's pathetic! Zero new elements, zero imagination! It was 2 hours and 30 minutes pointless and only 30 mins worth! ( Black Widow storyline, Iron Man storyline) About Captain America, they give him poor ending, about Thor, they made him a Joke! About Hulk, they made him powerless! About the other characters, they put them in the movie only to say that they put them! And finally, ZERO PURE SUPERHERO ACTION!!! Only 10-15 minutes, only!! For me, its one of the most overrated movies of all time! Disappointed."
	
"You can't go back and change the beginning, but you can start where you are and change the ending."
	
"It was underwhelming. I guess I had expectations for it, some people hyped it up too much. Infinity was better."
	
"WITHOUT TIME TRAVEL!1. Thanos does not destroy the gauntlet and Thanos does not die immediately at the beginning.2. Redeeming the hate for Captain Marvel: I personally like her character. I enjoyed the Captain Marvel movie. That being said they should have brought her in, had character development with the remaining Avengers team, and got to the task of taking on Thanos and reversing what had happened in Infinity War. It could turn out that her power doesn't exceed but matches Thanos' power. Another possibility is that Thanos who finally has all of the Infinity Stones learns of yet more power that the Gauntlet unleashes. So many possibilities really they never even delved into the Gauntlet and what all it could do.3. That being said they could have tackled it numerous ways without the use of time travel, i will put one scenario out there. With the added power that Captain Marvel brings to the team they could take on Thanos, somehow acquire the Time Stone from the Gauntlet and use that to reverse time. Hell they could even have a huge CGI blowout where time is traveling backwards while they are fighting the mighty Thanos. Time reverses until they get back to the point where Infinity War left off. With all Marvel characters present they could have the biggest battle scene a Marvel movie has had to date. One where they tie up the contract issues with the actors and the ones that have to die could have died during the battle. So many variations they could have gone with and made it a much more edge-of-your-seat ride than what they put out, which was mostly boring, filled with plots holes and left me underwhelmed to say the least. I have no plans to re-watch Endgame in the near future, if at all.In conclusion i just wrote this in five minutes on a lazy Sunday afternoon after a week of brooding about how bad Endgame was. Marvel had an entire team of hundreds, probably thousands of people to put out a better product than what we got. It was a cop out film and everyone involved should be embarassed that that was the final product after so many years of building this exciting franchise."
	
It s the first time i bother to write a review about a movie....but i m so disappointed that i have to say some things....i saw the movie having the highest expectations as a marvel fan and after the infinity war which was a masterpiece.....this movie was a DISASTER...i really felt bored...no action...silly jokes and favorite characters that in all previous marvel movies were strong and fighters now they were like random guest stars...i don t understand why the plot had to ruin thor hulk and thanos...i left the cinema with my friends and we were all disappointed....i really don t understand how everybody says this is a PERFECTION.....marvel has given us really great movies....unfortunately that was not one of them...
	
How can people give this film anymore than one star! Infinity war was amazing and set up such a good story then this guff appeared in our screens! Sickening political correctness moments! What was the point of hyping captain marvel for her to be in this for 5 minutes! Ruined the hulk character! Best character by far was happy who had the best scene in the movie!
	
"I think Marvel films are fine, I understand loving them I really do. Spider-Man 2 is my personal favourite, but please stop giving these movies a 10/10. Endgame is a 7 at best. It's probably the most flawed Avengers film story wise. It's popcorn fun, but it's like if we let Fast & Furious or Transformers films in the top 250. Meanwhile 2001: A Space Oddisey is lower than Infinity War."
	
"Not sure if it's a good idea to write a review here, as it seems, that Fanboys are rating down carefully considered reviews, just because they are not praising endgame, but so be it.I was not really disappointed, but I was also not stunned by this movie. It had a lot of shortcomings, logic-flaws and humor that simply wasn't funny or jokes that were somehow not fitting into the storyline. Some characters developed in a direction, I personally did not like and the overall ending to the movie seemed rushed and somehow chaotic.Overall it was a decent ending to this MCU phase, but as always, it's down to personal preference if you like a movie or not or if you wished for a different storyline.There are too many things, that were illogical:
Nebula not telling the guys what it takes to get the soul stoneTony Stark not even questioning why Pepper is in the end-fight and not taking care of their childrenDepressed, fat ThorCaptain America being able to use Thor's hammerCaptain America living a life with his girlfriend without someone remembering it in their timelineAll of a sudden, all dead heros appear out of nowhere - all coming from Wakanda - how the heck did they know and gather in the first place?If you haven't seen Captain Marvels end credit-scene, Captain Marvel would appear right out of nowhere in this movie and everyone would wonder why.Thor being depressed and fat and this Softie-Version of Hulk were the main character developments I also did not like.Personally didn't like Tony Stark being killed, but one saw that coming. After all, his story was told. Captain America living another live at least got him a happy end, although and illogical one. The hairstyle of captain Marvel ... ok, let's not talk about this one.There are certain scenes that are indeed epic, overall, the movie was entertaining, but I honestly liked Infinity War more.Cannot tie this to specfic reasons, it's a combination of all the aforementioned elements, that simply didn't do the trick for me to make it an epic movie.Considering myself being a big fan of the MCU franchise, I think all fans should see it, but if you are at least somehow interested in a decent and logic storyline, be warned you might not be too overwhelmed by this movie."
	
"Are you moviegoer? Waited to long for conclusion? You'll be disappointed.
No heart in movie. No character depth and worst of all there are incidents whether they cared about story at all.
Verify yourself..
1. All the avengers are shown cry babies. Looks like they are fighting without purpose. How are they going to defend their motive - that we support hunger and poverty! They bring war again to the earth and snapped Thanos' army. Then what does changed - that Thanos killed more and we killed less!
At least Thanos had genuine intent.
They should have have cared more about story.
2. All the movie they discussed philosophy, paradox and science of time travel and yet failed to deliver on that front.
i. Future Nebula kills her own past still she exists in present.
ii. Captain himself altered the time line. Are there no consequences?
iii. They kill Thanos' past. How come future is still same.
The reason thrown in movie is that they are playing with their own time line. Does our life and time lines work this independently.
3 Most worse (I know, I'm using 2 superlatives in single sentence.)
In whole movie, in all fight scenes all you witness is death of bad guys and conveniently not a single good guy die there.
villain bombs the building whole structure collapses and yet surprisingly no one dies.Ok.. There are more you'll find them yourself if you watch the movie.If want some respite then Gamora is not shown in last scene and you can cry out where is Gamora.P. S. On single watch i reached to this conclusion that this is the worst, out of reference movie of Marvel universe. If you think otherwise please share."
	
"2,5 hours of nonsense and gigantic plotholes. 15 minutes of action which is a total mess. CGI looks good, bit dark. Thor, one of the strongest badass characters in Marvel Universe is a drunk fat dude, does not make sense. Cap. America who can use Thors Hammer suddenly with lightning abilities, why? Cap. Marvel is OP, shows up randomly does huge amounts of damage and dissapears again list goes on and on... Iron man is the only character in this movie who deservers credits in my opinion. Infinity war is way better, its really overrated."
	
"Overrated, 2 boring hours and 1 hour fighting. A movie that depends on the effects only"
	
