"There is no way that I could describe my emotions for this movie. I'm totally speechless. I haven't laughed (even cried) this much in Marvel movie or even in any movie. I'm fully on my emotion, there are so many tears of joy and loss. Amazing story, the acting is outstanding, epic action, great CGI, the best storytelling ever told in a superhero movie, amazing performance. I love it more than 3000.Happiness, sadness, pure joy, excitement... I'm gonna miss this moment in my whole life because let's face it- it's been awhile movies can bring such a big enthusiasm like this.It is such an experience you'll gonna remember it forever. People are clapping, laughing, crying, full of a state emotion. It's 3 hours long but it went by like a finger snapping by Thanos, and now I'm thinking I'm actually in Quantum Realm because it felt like 5 seconds. Even though you know where the story is gonna bring you because it's still a 'superhero movie' but it left me speechless. It's not just a superhero movie, it's more than that.Even some characters that you didn't like before, you will love them in this movie. Like Captain Marvel. I didn't like her before in her own movie but in Endgame they showed how powerful, how strong and how capable she really is. And now I kinda love her! But Marvel should really be careful of her line though, I didn't like some of her line like I'm the strongest and You didn't win because before you didn't have me duh. Also not gonna forget Hawkeye. To be honest, in Avengers I really didn't like Hawkeye because he's just a 'guy' with an arrow and just randomly showed up in any scene but actually he's character is so BADASS! Everything that we need, what we want is here.Also I don't get it why some people can not accept that Thor is fat or treat him like a joke. I mean, this movie might be trying to give us a message about no matter what 'shape' are you, you can be a hero and save the world. To be honest, I like what they did to Thor, that man is depressed and taking the most responsible after he missed the shot to kill Thanos in Infinity War. Even though he already did killed him but it's not gonna bring back his people of Asgard. Also he's God of Thunder for god sake, he could slap his stomach with thunder and got his abs back.I'm so happy too for Captain America. Finally he could do his dance with Peggy and I didn't expected that we could see the fight between Captain America with his own self. Also when Tony met his father really warm my heart, and we can see the 'real-life' Jarvis - I didn't expected that too.When the whole superhero arrived it is so EPIC! The whole person in theater are screaming and shocked. Gives me a goosebumps and still left me speechless!This movie is absolute perfection. The ending of this movie is we and the characters deserved. It gives a perfect balance for all these past 10 years. Epic and perfect ending, I was not disappointed at all. This movie was completely emotional and visually stunning. Now I get it why the Russo Brothers told us to do a Marvel Movie marathon before watching Endgame because this movie had everything to accomplish what left behind before all of this.Ready or not, whatever it takes.Go watch it for yourself."
	
"This is probably the highest 8/10 I could give for an 8/10 movie.There are some very good moments in Endgame and that's coming from a long standing MCU fan growing up with these movies. In creating an extensive and emotional journey for a lot of the MCU characters, it absolutely succeeds.Endgame ultimately is an excellent conclusion to over 10 years of film but I feel the plot's pacing and direction is really lacking to Infinity War, which 'trimmed the fat' and was much more focused and energetic. Granted, Endgame takes risks but this might be a disappointment to some fans with its slower pace that focuses on character development over action and intense sequences. The run time probably should be shorter or streamlined. Less cuts and motion blur during fight scenes would've made it easier to track fights as well.Respect for the Russo Brothers for taking the direction they did with Endgame and it really does satisfy but Infinity War is overall a more entertaining movie. It's not the best MCU movie but I can't dispute its great conclusion."
	
"If you're going to watch this movie, avoid any spoilers, even spoiler free reviews.
Which is why I'm not going to say anything about the movie. Not even my opinion. All I'm going to say is:The crowd applauded 3 times during the movie, and stood up to clap their hands after. This I have never witnessed in a Dutch cinema. Dutch crowds aren't usually passionate about this. I checked the row where I was sitting, and people were crying. After the movie, I was seeing people with smudged mascara. That's all I have to say about the movie."
	
"I have to say, my first reaction walking out of the cinema was that it was great. Probably an 8/10. You know there's so much fan service in this movie and I particularly loved the I can do this all day CA line from one CA to another. It was almost Toy Story 2, enlightened Buzz to naive Buzz banter.I loved Clever Hulk, found Thor hilarious, though a bit annoying at times, and loved the references to past movies. Cap swinging Mjollnir around was beautiful.The deaths in this movie were also pretty surprising but I agree with some of the more balanced reviews in here that it was bizarre that so much time was spent on Hawkeye - does anyone really care about him? Not really.Killing off Black Widow was a surprising touch, but I, like many others, probably felt more of an emotional reaction to Banner's relationship with her and not Hawkeye (because no one actually cares about him). Renner, as an actor, just doesn't cut it much, unfortunately.The real problem with End Game, is the time travel. I don't know why any movie franchise would ever want to deal with time travel knowing how much grief it creates. Sure they try to explain everything with their hilarious conversation about movies, but in the end, there are just too many questions left at the end of the day, particularly when they already try to explain it through the Ancient One.The most glaring one of these is, if they change the past, they're changing another timeline, so how selfish is that? If Tony Stark snaps his fingers and kills Thanos, what happens to that original timeline? If he sent Thanos and everyone back, how does he magically know not to send Gamora back who is now stuck in 2023 - and so does that mean 2014 Quill never meets Gamora?!? What the hell? Essentially erasing the entire 2014 GOTG franchise in that universe. If Captain America goes back in time, he will inevitably change history in some way or another, so that is another timeline, right? So while everyone else's timeline is meant to stay the same in the present (as said by Stark) how does Cap end up sitting by the same lake as everyone else.There are also way too many questions about new timelines created - but perhaps that is intentional, such as the Loki TV show. But this is why I hate it when they bring time travel into any movie and just add stuff to it to make it wrap up nicely in their own universe.Also, don't get me started on how impossibly strong Thanos suddenly is without an infinity gauntlet? Even WITH the IG he couldn't stop Thor's Stormbringer, but now without the IG can easily defeat Thor with Stormbringer AND Mjollnir, Iron Man and Cap??? How convenient.I also think Marvel made a serious mistake creating Captain Marvel, how is she brought in as a convenient deus ex machina and yet doesn't really stick around to show off all her abilities, and she can't even defeat Thanos single handedly? Pfft. That was rich. She can barely prevent Thanos from snapping his fingers, yet in Infinity War, Cap was able to actually hold off his hand too? Bizarre parallels.So okay, sure, it was enjoyable to watch, but I just feel that there are too many plot inconsistencies creeping into End Game. There should have been better ways to get the infinity stones back, and I think someone stupid just thought time travel was the best way to do it,."
	
"I've just come from watching Endgame and I must say that I am disappointed.I loved Civil War and I loved Infinity War. When I came out of those films, I knew immediately that they were great and that I wanted to see them again. With Endgame, I'm not sure.I respect how they were prepared to show the consequences of what Thanos had done but by killing him off so quickly and then them having to do their own stone quest (hadn't we already seen Thanos doing this in IW) it felt slow and lazy. Worse still was that it felt very self-indulgent and attempting to be clever for clever sake.Like how Back to the Future II considered itself clever for showing the events of the first film but with Marty flitting around behind the scenes to ensure that it all still happened. I know it's meant to be fan pleasing but it really felt like a gimmick and lacking in confidence. Almost like it was saying 'Hey guys, this will make you smile'. If you want to make me smile, concentrate on maintaining the quality of your product rather than directly trying to make me like you.But the trouble with messing around with timelines and bouncing around is that it makes the audience start asking questions during the film. The linearity that we'd seen in IW and the imminent fast approaching threat is replaced in Endgame with a lack of direction and characters that are earlier versions of who the audience have seen.In IW we were shown Thanos. He was written to be sympathetic or at least a character that we the audience could understand. He believed in what he was doing and this made him more rounded. But in Endgame, that version is dispatched quickly and we are supplied with a 2014 (?) Thanos who isn't the character we know but is just a token bad guy.This Thanos hasn't made the sacrifice at Vormire, he isn't the guy that would empathise with Scarlet Witch for what she did to Vision. He has suddenly become a token cut out evil bad guy that needs to be defeated. Hell, the writers even manage to forget their own time loop by saying that this Thanos has learnt that he doesn't want to wipe out 50% anymore because they are too ungrateful. How does he know this when the 2014 Thanos has only just literally arrived in the post wipeout Universe? How has he had time to form the opinion that his previous quest for a 50% cull isn't worthy?Is this a case of the writers being terrified that they had created a bad guy that people related to or was it a fear that they'd written themselves into a hole? Why go to the effort of creating that character in IW to suddenly kill him off at the beginning of Endgame just for a dramatic punch?For me, the time travelling and stone gathering wasted time to create unimportant scenes that fundamentally undermine the films that came before.
In my opinion it would have been better if they had shown the remaining Avengers preparing to do some Avenging and maintained the single minded linearity of IW of battling towards and reaching a post click Thanos and somehow reversing his work.The more I think of the film, the more plot holes and frustrations manifest themselves. Thor's drinking and man child antics might have been initially funny but one begins to realise that they are deliberately doing this to clip his wings. Likewise with Hulk, his primordial desire to smash and destroy has been removed to think it out and he has become an embarrassing shadow of his former self.The thing that is meant to be amazing about the MCU is the world building but inconsistencies have been appearing and there are so many in Endgame that it makes you question whether these two films are written by the same people.In IW, Thanos is a dangerous and credible threat because he has the infinity stones. He takes on half of the Avengers, Strange and some of the Guardians on Titan and smashes them and then takes on the other half on Wakanda and smashes them. Yet it is Stormbreaker (whose creation we have seen been hard earned by a motivated Thor) that has the power to take down Thanos even when he has a full complement of Infinity Stones.Yet we roll forward to Endgame and we have literally all the good guys together in one place, Cap with his shield, Tony fully powered up, Scarlet Witch p*ssed and vengeful, Capt Marvel who can seemingly do anything and Thor wielding both Mjolnir AND Stormbreaker and Thanos NOT in possession of the gauntlet, yet they can't defeat him.It's like the fights in IW were so amazing because the good guys were taking on an unbeatable foe yet here he is now seemingly defeatable by the 'rules' that the writers established . A good example of this would be in IW when Cap is the last man standing before Scarlet Witch and he grabs the gauntlet. You see the look of admiration/respect on Thanos' face that Cap is holding open the gauntlet before he punches him to the ground yet now that scene seems pointless.The writers for Endgame seem to have been driven to undo everything they did in IW. All the tension, all the sacrifice, all the development of Thanos discarded for well, I don't know what. It makes no sense.IW had two incredible scenes that used to choke me up. When Cap appears in the train station, the Avengers theme kicks in and Falcon and Widow take down the henchman in a wonderfully choreographed scene. In just that one scene it shows them coming to the rescue, it shows how intuitively they work together and it showcases their heroism.Likewise when Thor creates Stormbreaker and makes his entrance on Wakanda, I felt it for the journey that Thor has been on. He's had to contend with loss and defeat and humiliation and this is his redemption. Here is a character that has earned his game changing weapon and when he arrives and demands to face a character that everyone else is running away from, I want to punch the air.But in Endgame, that feels like it has to be corrupted. We can't have Thor being dominant, let's break him and make him a fool. We can't have Thanos being complicated and relatable, let's make him a cut out bad guy. We can't have Hulk being rage fuelled and smashing stuff up, let's make him more sensitive and talking stuff out. We can't have Cap being stoic and heroic, let's have him ridiculing one of his own iconic lines in a silly gimmicky fight with himself and commenting on his butt. We can't have a powerful female character that we're invested in look sexy AND be able to take down Thanos, let's give Scarlet Witch a small part but focus our attention on a female character that hasn't earnt our admiration or desire for revenge.To be honest, the 'rules of engagement' had been set so well in IW that when in Endgame Thanos massed his ranks against the Avengers and then ALL of the good guys showed up, I was almost expecting the camera to pull away and not show the fight given that it was so obviously going to be an easy win for the good guys.And as for the big fight scene, it did reek of what DC always manage to do which is just throw everything into an end battle and bludgeon you with CGI and pyrotechnics so that you aren't really sure what is going on.In the many fights in IW, you knew what was going on, you recognised the combatants, you understood the stakes and you identified the geography of the scene. In Endgame we got one big massive fight where everything was thrown in the pot and it was just assumed by the directors that we would be happy with all the flashing lights.
And I have to say that considering that Steve and Tony fell out so hard, and that Tony's criticism of Steve was so unfair, that I really had hoped for more than just a handshake, a muttering of 'no worries' and 'here's your shield'. These guys wrote and directed Civil War, they created the line 'we fell out hard' and hence I had hoped for something deeper and more touching than a handshake.Steve wrote Tony a letter telling him that when he needed him he'd be there but once again the Iron Man bias had to creep in and once again Tony was the victim and the ultimate hero.But I think my biggest problem is how the convenient time travelling undermines everything. When a franchise starts retrofitting stuff (like Fury's eye being from a space cat), it's then hard to consider the previous stories.Having 2014 Gamorra means that all the evolution that we saw her go through in GOTG 1 and 2 is wasted. Having Cap marry Peggy means the pain of his sacrifice, him seeing her in Winter Soldier when she is suffering from Alzheimer's, hell even his blossoming relationship with Sharon Carter is kinda irrelevant. Having seen Thor at last step away from his two weaker origin films into the entertainment of Ragnarok and the redemption in IW leaves us now with a bumbling buffoon.We know that what makes Captain America what he is, is the serum that makes him a super soldier. That he was transformed from a weakling to a superhuman. Sam Wilson is not a super soldier and he didn't take the serum. He is Falcon. Now maybe in the comics he becomes Cap but Bucky is a super soldier. Is the new Cap going to foil an evil plot and be defeated with a tazer or a knife to the chest? Consider the beatings that Steve has taken and the physical strength that he has shown we can recognise that Sam Wilson does not have that.I'm sorry to say but the Russo's have dropped the ball. Themselves and their writers have succumbed to their success and their desire to be engineers of political correctness and social change. I thought Endgame would be the high soaring end to this 10 year run of impressive movie entertainment but in the end the writers got carried away, the directors over reached and the studio sacrificed the integrity of their product for a chance to 'educate' us all. A real shame and a wasted opportunity.Infinity War is clearly the highlight of the last 10 years but even now I fear that repeated viewings will render it pointless considering how the makers decided to fundamentally damage it."
	
"Unpopular opinion.
Let me start by saying that Endgame is not a bad film. In fact it was a decent film. But nothing more. Maybe I was expecting a masterpiece like Infinity War due to all this hype.
The first 2 hours of the movie are really boring. They try to build up many emotional moments only to destroy them with a joke the next minute. And there are really MANY jokes that feel out of place.
Endgame uses the previous marvel movies to give you a good story, without building it itself. It's like the writers didn't care to give us a proper story. They just filled it with many dramatic moments. Also, there was no action in the first 120 minutes.
Plus, I did not like the way they treated Thor at all. They made him a comic relief in the worst way possible. I wonder how Thor fans feel after watching this.
The last battle was epic and beautiful but that's all I really enjoyed. The cgi was top notch.
Also, the way they ended Cap's story, meh... Yeah we got it, you want to make people cry and give us the end of an era, but at least do it without creating dozens of plot holes.
The 3 hours went by fast, but I wouldn't watch it again in theaters (I had planned to watch it at least 1 more time).
This could be so damn good... Disappointed.*edit* Also, all of you fanboys who downvote all my reviews because you got angry because I gave your beloved Avengers a 6, you are just amusing and pathetic. Get a life."
	
"First of, Infinity War was the greatest MCU movie ever made IMHO.Of course, following it up was never going to be easy, and it's sheer greatness and the impact of the 'snap' was something that the Russos just couldn't navigate a way out of. However, plot difficulties aside, there was really no excuse for some of the poor character treatment and pacing issues that they had.Positives:
RDJ's actingNatasha and Hawkeye's last interactionsCGINegatives:
Abysmally poor treatment of Thor, reduced to a comic relief sideshowAbysmally poor treatment of the Hulk - One of the strongest characters of the MCU didn't fight more than 10secs in the 2 supposedly landmark movies of the MCU??Completely ruined Thanos - reduced to a caricature 'bad guy' after an excellently built character in IWPoor re-introduction of the vanished Avengers - seems most of the team wasn't even paid and they just used some stock footage from previous movies for their blink and you miss appearancesWasted potential of Capt Marvel - why introduce a character so powerful, and then not use them for >95% of the movie?Pacing - all over the place. Could easily have trimmed the fat and achieved a much more coherent productMore of a Cap+Stark movie than an Avengers movie.Time travel plotholes - hellloooo. I was OK with the main plan of stealing, snapping, restoring the stones. Hell, I am even OK with Cap getting the happy ending (assuming he stays in hiding his entire life and Carter's life decisions are not affected by the guy in her basement). But as soon as Thanos goes to the future and dies there, Uh Oh - did we just lose the entire Infinity War?? Maybe I am too dumb to understand this...In the end, while the homage to the movies and characters was fine, I really wanted to have a movie I would rush to watch again (Like I did with IW). Sadly, they couldn't deliver this time."
	
"After Infinity War I had huge expectations. Unfortunately I think it doesn't follow the comic book at all because they wanted some kind of closure of the story.
I saw a lot of 10 star reviews and I cannot believe the majority of people like this movie more than Infinity War.
I'm not saying it wasn't entertainment to watch but the feeling is that all heroes were forced to fit in a movie paying a big price to the story.
There are moments in the movie where the rules from all other Marvel movies are broken and characters which were build over hours of screen time were reduced in order to make space for others.
The story is average at best with big flaws."
	
Absolute perfection end game !! Good acting performance to all the characters. Great cgi's. Truly epic & perfect ending to a long journey of marvel movie. Go see it you wont regret it !! Perfection Marvel Endgame !!
	
The best superheroes movie a end of era for marvel was very good
	
